Product,917,"Lion Toasted Coconut Whole Bean Coffee, 24 oz. Bag",P,1248524,,,,Right,"<p>Light Medium Roast. <span style=""color: #000000; font-family: 'Helvetica Neue', Helvetica, Arial, sans-serif;"">A Lion Coffee all time favorite flavored coffee. You will find something very enjoyable about the aroma and nutty taste of our Toasted Coconut Coffee. That satisfying aroma and coconut coffee flavor from lightly roasted coffee beans makes this a very special coconut coffee.</span></p>",27.45,0.00,0.00,0.00,0.0000,N,,2.0000,0.0000,0.0000,0.0000,Y,N,,none,0,0,,2952,d/655/Toasted_Coconut_New__93043.jpg,"A Lion Coffee all time favorite flavored coffee. You will find something very enjoyable about the aroma and nutty taste of our Toasted Coconut Coffee. That satisfying aroma and coconut coffee flavor from lightly roasted coffee beans makes this a very special coconut coffee.
Roast:Light Medium Roast",Y,0,2960,b/612/New_Lion_Logo__03694.jpg,"One of America’s oldest major coffee companies, Lion Coffee roared to life in 1864 in Toledo, Ohio. After moving to Hawaii in 1979, Lion Coffee quickly became and has remained the favorite local coffee brand.",N,2,,,,,,,,,,,,,,,,,,,,,,,,,,,"Lion Coffee, Toasted Coconut Whole Bean Coffee, 24 oz. Bag","Lion Coffee,Hawaiian,Chocolate Macadamia,vanilla macadamia,kona,coconut","Experience the exotic flavor of Lion Coffee, Toasted Coconut Whole Bean Coffee. The quality selection of Hawaiian style coffee is carried at La Costa Gourmet.",,,,New,N,N,,N,,,0,"Default Tax Class",,N,/lion-toasted-coconut-whole-bean-coffee-24-oz-bag/,,,1248524,,
Product,919,"Lion Vanilla Macadamia Nut Coffee, 24 oz. Bag",P,1248384,,,"Lion 24oz. ",Right,"<p>Light Medium Roast. <span style=""color: #000000; font-family: 'Helvetica Neue', Helvetica, Arial, sans-serif;"">A classic LION tropical flavored coffee. Lightly roasted coffee beans flavored with the distinctive aromas and tastes of Vanilla Beans and Macadamia Nuts. The brewed coffee has a rich smooth taste with Vanilla flavor notes predominate and with more subtle Macadamia Nut background flavor notes.</span></p>",27.45,0.00,0.00,0.00,0.0000,N,,2.0000,0.0000,0.0000,0.0000,Y,N,"Usually ships in 2 to 3 days.",none,0,0,,2954,g/783/Vanilla_Mac_New__35186.jpg,"A classic Lion tropical flavored coffee. Lightly roasted coffee beans flavored with the distinctive aromas and tastes of Vanilla Beans and Macadamia Nuts. The brewed coffee has a rich smooth taste with Vanilla flavor notes predominate and with more subtle Macadamia Nut background flavor notes. One of our top selling flavored coffees.
Roast:Light Medium Roast",Y,0,2961,f/102/LION_Logo_New__11035.jpg,"One of America’s oldest major coffee companies, Lion Coffee roared to life in 1864 in Toledo, Ohio. After moving to Hawaii in 1979, Lion Coffee quickly became and has remained the favorite local coffee brand.",N,2,,,,,,,,,,,,,,,,,,,,,,,,,,"LION VANILLA MACADAMIA","Lion Coffee, Vanilla Macadamia Nut Coffee, 24 oz Bag","Lion Coffee,Hawaiian,Chocolate Macadamia,vanilla macadamia,kona,coconut","Experience the exotic flavors of the signature Lion Coffee, Vanilla Macadamia Nut Coffee. An instant favorite, stock up at La Costa Gourmet with our 24 oz bags",,,,New,N,N,,N,,,0,"Default Tax Class",,N,/lion-vanilla-macadamia-nut-coffee-24-oz-bag/,,,1248384,,
Product,923,"Lion Chocolate Macadamia Nut Coffee, 24 oz. Bag",P,1248344,,,"Lion 24oz. ",Right,"<p>Light Medium Roast. <span style=""color: #000000; font-family: 'Helvetica Neue', Helvetica, Arial, sans-serif;"">Chocolate Macadamia Coffee is a customer favorite and a top selling flavored coffee. Coffee beans especially selected and medium roasted are the foundation for this flavored coffee which is infused with bittersweet Chocolate Macadamia Nut flavoring.</span></p>",23.45,0.00,0.00,0.00,0.0000,N,,2.0000,0.0000,0.0000,0.0000,Y,N,,none,0,0,,2953,o/054/Chocolate_Mac_New__02845.jpg,"Chocolate Macadamia Coffee is a customer favorite and a top selling flavored coffee. Coffee beans especially selected and medium roasted are the foundation for this flavored coffee which is infused with bittersweet Chocolate Macadamia Nut flavoring. Rich & Decadent without the calories!
Roast:Light Medium Roast",Y,0,2962,r/134/New_Lion_Logo__31849.jpg,,N,1,,,,,,,,,,,,,,,,,,,,,,,,,,,"Lion Coffee Chocolate Macadamia Nut Coffee  24oz  Bag","Lion Coffee,Hawaiian,Chocolate Macadamia,vanilla macadamia,kona,coconut","Taste the bold Lion Coffee Chocolate Macadamia Nut Coffee  24 oz  Bag. With a flavorful mix of freshly roasted coffee beans from around the world.",,,,New,N,N,,N,,,0,"Default Tax Class",,N,/lion-chocolate-macadamia-nut-coffee-24-oz-bag/,,,1248344,,
Product,931,"Lion Whole Bean 100% Kona Coffee, 24 oz. Bag",P,1078724,,,,Right,"<p>Lion Coffee selects the top of the crop. 100% pure Kona Whole Bean Coffee, silky smooth, gentle taste. Medium Roast. Fresh from Kona Coast, famous for its coffee.</p>",69.95,0.00,0.00,0.00,0.0000,N,,2.0000,0.0000,0.0000,0.0000,Y,N,"Usually Ships in 1 to 2 Business Days",none,0,0,,2679,s/173/100_Kona_6x6__76713.jpg,"100% Kona Coffee beans from Hawaii's Kona Coast. Our Hawaiian Kona Coffee is selected from the best of the Kona Coffee harvests. These big, flavorful Kona Coffee beans are expertly roasted to produce a consistent and truly gourmet coffee when brewed. It will become a favorite. ",Y,0,3022,o/427/New_Lion_Logo__39404.png,,N,1,,,,,,,,,,,,,,,,,,,,,,,,,,"Kona Coffee","Lion Coffee, Whole Bean 100% Kona Coffee, 24 oz Bag","Lion Coffee,Whole Bean 100% Kona Coffee","Enjoy that classic Kona flavor with Lion Coffee,Whole Bean,100% Kona Coffee Lion Coffee, Shop our selection of Hawaiian style coffees at La Costa Gourmet.",,,,New,N,N,,N,,,0,"Default Tax Class",,N,/lion-whole-bean-100-kona-coffee-24-oz-bag/,,,1078724,,
Product,945,"Lion Coffee, 12 K-CUPS LION FRENCH ROAST",P,SSC-LCFR,,,,Right,"<p><span style=""color: #000000; font-family: 'Helvetica Neue', Helvetica, Arial, sans-serif;"">From Hawaii, land of volcanoes and lava flows, comes LION French Roast Coffee. This French Roast is intense. Full-bodied. It has a delicious dark roast finish. But do know this... this is a bold, snappy and aggressive French Roast for those who like their coffee with attitude!</span></p>",14.75,0.00,0.00,0.00,0.0000,N,,0.8000,0.0000,0.0000,0.0000,Y,N,"Usually Ships in 1 to 2 Business Days",none,0,0,,3018,z/072/French_K_Cup_New__15066.jpg,"From Hawaii, land of volcanoes and lava flows, comes LION French Roast Coffee. This French Roast is intense. Full-bodied. It has a delicious dark roast finish. But do know this… this is a bold, snappy and aggressive French Roast for those who like their coffee with attitude! Now available in a single serve cup.Enjoy the flawless smooth taste and finish that you trust LION Coffee to provide.",Y,0,2594,c/229/KCUP-LCFR-4__97634.jpg,"Each box contains 12 single cup pods. 
Compatible with most KEURIG K-CUP Brewing Systems. ",N,1,2588,z/346/KCUP-LCFR-2__40189.jpg,,N,2,,,,,,,,,,,,,,,,,,,,,"Lion K-Cup","Lion Coffee, 12 K-CUPS LION FRENCH ROAST | SSC-LCFR",,"LION Coffee has been making a bold flavored statement since 1864. Featuring a blend and freshly roast the finest Arabica beans from around the world.",,,,New,N,N,,N,,,0,"Default Tax Class",079975256330,N,/lion-coffee-12-k-cups-lion-french-roast/,,,SSC-LCFR,,
Product,947,"Lion Coffee, 12 K-CUPS ORIGINAL LION",P,SSC-LCORI,,,,Right,"<p><span style=""color: #000000; font-family: 'Helvetica Neue', Helvetica, Arial, sans-serif;"">Original LION Coffee is noted for its subtle sweet taste and flawless smooth finish. This original coffee blend is created from hand selected coffee beans from specific growing regions. Original Lion Coffee blend has satisfied our customers and friends since 1864.</span></p>",14.75,0.00,0.00,0.00,0.0000,N,,0.8000,0.0000,0.0000,0.0000,Y,N,"Usually Ships in 1 to 2 Business Days",none,0,0,,3019,t/579/Original_K_Cup_New__28697.jpg,"Original LION Coffee is noted for its subtle sweet taste and flawless smooth finish. This original coffee blend is created from hand selected coffee beans from specific growing regions. Original Lion Coffee blend has satisfied our customers and friends since 1864. Over the years, they come back to this coffee again and again. It’s over a century of coffee roasting experience in your cup!",Y,0,3020,n/997/LION_Logo_New__59528.jpg,,N,1,2610,e/492/KCUP-LCORI-3__94210.jpg,"Each box contains 12 single cup pods. ",N,2,,,,,,,,,,,,,,,,,,,,,"Lion Coffee Original","Lion Coffee, 12 K-CUPS ORIGINAL LION | SSC-LCORI",,"LION Coffee has been making a bold flavored statement since 1864. Featuring a blend of freshly roasted coffee beans from around the world.",,,,New,N,N,,N,,,0,"Default Tax Class",079975256309,N,/lion-coffee-12-k-cups-original-lion/,,,SSC-LCORI,,
Product,957,"Big Train Vanilla Latte Carb Conscious Blended Ice Coffee Mix Two 1.85 lb Cans",P,20501797,,"Big Train",,Right,"<p><span style=""color: #666666; font-family: Tahoma, Arial, Helvetica, sans-serif;"">Sometimes life is fair! With only 2 grams net carbs per 8 oz serving, no added sugar and a rich, creamy taste, Big Train's Low Carb Vanilla Latte Blended Ice Coffee mix allows you to get your blended ice coffee fix while maintaining your low carb lifestyle.</span><br /><br /> <a href=""https://lacostagourmet.com/v/vspfiles/templates/210/images/nutritional_btlowcarbbev.pdf"" target=""_blank"">View Nutritional Facts</a></p>",107.80,0.00,0.00,0.00,0.0000,N,,4.6000,0.0000,0.0000,0.0000,Y,Y,"Usually Ships in 1 to 2 Business Days",none,0,0,"Brand Names/Big Train;Frappe Mixes/Big Train Frappe Power;Frappe Mixes/Big Train Low Carb;Frappe Mixes/Carb Conscious",3321,m/193/BT_LC_Vanilla_Can__32408.jpg,"Big Train presents our low carb Vanilla Latte Blended Ice Coffee Frappe Mix, made especially for you! Invigorate your senses and enjoy the sweet vanilla indulgence of Big Train's classic vanilla latte mix! Our sweet, creamy drink mix revives with aromatic, full-bodied coffee and smooth French vanilla flavor. Serve hot, iced, or blended.",Y,0,3319,f/178/BT_LC_Vanilla_Can_Back__48693.jpg,,N,1,3320,k/543/BT_LC_Vanilla_Nutritional__07697.jpg,,N,2,,,,,,,,,,,,,,,,,,,,,,"Big Train Low Carb Vanilla Latte Blended Ice Coffee Mix 1.85 lb Can | BT.772110","Big Train,Low Carb,Mocha,Vanilla,Spiced,Caramel",,,,,New,N,N,,N,,,0,"Default Tax Class",642628286055,N,/big-train-vanilla-latte-carb-conscious-blended-ice-coffee-mix-two-1-85-lb-cans/,,10642628286052,20501797,,
Product,958,"Big Train Mocha Carb Conscious Blended Ice Coffee Mix Two 1.85 lb Cans",P,20501795,,"Big Train",,Right,"<p><span style=""color: #666666; font-family: Tahoma, Arial, Helvetica, sans-serif;"">With only 2 grams net cars per 8 oz serving, no added sugar and a rich, creamy taste, Big Train's Low Carb Mocha Blended Ice Coffee mix allows you to get your blended ice coffee fix while maintaining your low carb lifestyle.</span></p>",107.80,0.00,0.00,0.00,0.0000,N,,4.6000,0.0000,0.0000,0.0000,Y,Y,"Usually Ships in 1 to 2 Business Days",none,0,0,"Brand Names/Big Train;Frappe Mixes;Frappe Mixes/Big Train Frappe Power;Frappe Mixes/Big Train Low Carb;Frappe Mixes/Carb Conscious",3322,q/338/LC_Mocha_Can__69596.jpg,"With only 2 grams net cars per 8 oz serving, no added sugar and a rich, creamy taste, Big Train's Low Carb Mocha Blended Ice Coffee mix allows you to get your blended ice coffee fix while maintaining your low carb lifestyle.",Y,0,3323,e/324/LC_Mocha_Can_Back___07044.jpg,,N,1,3324,w/813/LC_Mocha_Can_Mixing__57569.jpg,,N,2,2461,w/149/BT.771110-4__43605.jpg,,N,3,2464,u/585/BT.771110-5__29366.jpg,,N,4,,,,,,,,,,,,"Big Train Low Carb Mocha Blended Ice Coffee Mix 1.85 lb Can","Big Train,Low Carb,Mocha,Vanilla,Spiced,Caramel","Big Train Low Carb Mocha Blended Ice Coffee Mix. Shop in bulk or stock up your home or coffee shop. La Costa Gourmet has a great selection of mix beverages.",,,,New,N,N,,N,,,0,"Default Tax Class",642628286024,N,/big-train-mocha-carb-conscious-blended-ice-coffee-mix-two-1-85-lb-cans/,,10642628286021,20501795,,
Product,959,"Big Train Dragonfly Coconut Blended Creme Frappe Mix Five 3.5 lb. Bags",P,20501781,,"Big Train",,Right,"<p><span style=""color: #666666; font-family: Tahoma, Arial, Helvetica, sans-serif;""><span>Sail off to the tropics with Big Train&rsquo;s Dragonfly Coconut Blended Cr&egrave;me Frappe Mix. This Big Train beverage mix uses the fresh taste of sweet coconut in a creamy base that ensures smooth, consistent texture. If you crave coconut, you will love this on its own, or try it with banana, berries, or chocolate for a twist on one of nature's most popular fruits. For an indulgent creamy finish, top with a dollop of whipped cream. You will want to make drinks using this blended mix from Big Train over and over again!</span></span><br /><br /></p>",152.40,0.00,0.00,0.00,0.0000,N,,19.0000,0.0000,0.0000,0.0000,Y,Y,"Usually Ships in 1 to 2 Business Days",none,0,0,"Brand Names/Big Train;Frappe Mixes/Big Train Coffee Free Frappe Power",3216,b/134/Coconut_Front__60499.jpg,"This Big Train beverage mix uses the fresh taste of sweet coconut in a creamy base that ensures smooth, consistent texture. If you crave coconut, you will love this on its own, or try it with banana, berries, or chocolate for a twist on one of nature's most popular fruits. ",Y,0,3217,a/442/Coconut_back__52220.jpg,,N,1,2419,e/754/BT.656110-3__25059.jpg,"Ingredients: Sugar, Coconut Oil, Fructose, Corn Syrup Solids, Nonfat Milk, Sodium Caseinate (a milk derivative), Natural and Artificial Flavors, Desiccated Coconut, Cellulose Gum, Dipotassium Phosphate, Silicon Dioxide (anti-caking agent), Propylene Glycol Esters of Fatty Acids, Mono- and Diglycerides, Salt, Soy Lecithin, Carrageenan Gum, Annatto Extract (for color).",N,2,2686,z/442/Dragonfly_Coconut_6x6__51977.jpg,"You don't need a passport to transport yourself to a tropical destination with this super delicious Asian-inspired coconut blended drink. In addition to being coffee-free, Coconut Dragonfly is easy to make.",N,3,,,,,,,,,,,,,,,,,"Big Train Dragonfly Coconut Creme Frappe Mix 3.5 lb Bag","Big Train, Blended Ice Coffee,20 Below Chocolate, 20 Below White Chocolate, Caramel Latte, Chocolate Malt, Chocolate Mint, Chocolate Peanut Butter, Coffee, Cookies n Cream, Decaf Mocha, Decaf Vanilla, Espresso, Heath Mocha, Java Chip, Kona Mocha, Mocha, No Sugar Added Mocha, Vanilla Latte, White Chocolate","Shop for the Big Train Dragonfly Coconut Blended Creme Frappe Mix 3.5 lb Bag. Browse online groceries today at La Costa Gourmet.",,,,New,N,N,,N,,,0,"Default Tax Class",642628014501,N,/big-train-dragonfly-coconut-blended-creme-frappe-mix-five-3-5-lb-bags/,,,20501781,,
Product,960,"Big Train Espresso Blended Ice Coffee Five 3.5 lb. Bags",P,20501767,,"Big Train",,Right,"<p><span>Big Train Espresso Blended Ice Coffee Frappe Mix is one of the easiest ways to mix-up a traditional iced coffee frappe. All that&rsquo;s needed is water, ice and a blender! </span></p> <p><span>This Big Train beverage mix is a blend of the finest ingredients and a signature creamy base with the taste of Italian espresso. It's the perfect morning or afternoon pick-me-up. Bon appetite! Serve hot, iced, or blended.</span><br /><br /></p>",152.40,0.00,0.00,0.00,0.0000,N,,19.0000,0.0000,0.0000,0.0000,Y,Y,"Usually Ships in 1 to 2 Business Days",none,0,0,"Brand Names/Big Train;Frappe Mixes;Frappe Mixes/Big Train Frappe Power",3247,a/219/Espresso_Front__76013.jpg,"Big Train Espresso Blended Ice Coffee Frappe Mix is one of the easiest ways to mix-up a traditional iced coffee frappe. All that’s needed is water, ice and a blender! This Big Train beverage mix is a blend of the finest ingredients and a signature creamy base with the taste of Italian espresso. It's the perfect morning or afternoon pick-me-up. Bon appetite! Serve hot, iced, or blended.",Y,0,3248,c/893/Espresso_Back__31060.jpg,,N,1,3249,i/676/Espresso_Nutritional__69165.jpg,,N,2,,,,,,,,,,,,,,,,,,,,,,"Big Train Espresso Blended Ice Coffee, 3.5 lb. Bag","Big Train, Blended Ice Coffee,20 Below Chocolate, 20 Below White Chocolate, Caramel Latte, Chocolate Malt, Chocolate Mint, Chocolate Peanut Butter, Coffee, Cookies n Cream, Decaf Mocha, Decaf Vanilla, Espresso, Heath Mocha, Java Chip, Kona Mocha, Mocha, No Sugar Added Mocha, Vanilla Latte, White Chocolate","Choose from top Big Train products such as coffee, chai tea, and frappes. La Costa Gourmet carries the Big Train Espresso Blended Ice Coffee.",,,,New,N,N,,N,,,0,"Default Tax Class",642628006745,N,/big-train-espresso-blended-ice-coffee-five-3-5-lb-bags/,,10642628006742,20501767,,
Product,961,"Big Train Caramel Latte Blended Ice Coffee Five 3.5 lb. Bags",P,20501765,,"Big Train",,Right,"<p><span style=""color: #666666; font-family: Tahoma, Arial, Helvetica, sans-serif;"">Caramel Latte Blended Ice Coffee from Big Train. Combining Arabica coffee with caramel and the finest ingredients, this drink is as easy to make as it is delicious. G</span><span style=""color: #666666; font-family: Tahoma, Arial, Helvetica, sans-serif;"">luten free, contains no trans-fat, no hydrogenated oils and is Kosher and Halal Certified.</span><br /><br /> <a href=""https://lacostagourmet.com/v/vspfiles/templates/210/images/nutritional_btblendedicecoffee.pdf"" target=""_blank"">View Nutritional Facts</a></p>",152.40,0.00,0.00,0.00,0.0000,N,,19.0000,0.0000,0.0000,0.0000,Y,Y,"Usually Ships in 1 to 2 Business Days",none,0,0,"Brand Names/Big Train;Frappe Mixes;Frappe Mixes/Big Train Frappe Power",3148,h/028/Carmel_Lattee_Front__36787.jpg,"Big Train Caramel Latte Blended Ice Coffee Frappe Mix is an easy way to craft one of your favorite frappe flavors. We use the finest Arabica coffee, then add rich caramel flavor and a dash of cocoa to our creamy base. Try it on its own, or get creative and customize with add-ins to enhance the rich caramel and cocoa notes. All you need is water, ice and a blender! Serve hot, iced, or blended.",Y,0,3149,o/275/Carmel_Latte_Back__78828.jpg,,N,1,3150,w/359/Camamel_Latte_Nutritional__26403.jpg,"Ingredients: Sugar, Coconut Oil, Maltodextrin, Corn Syrup Solids, Nonfat Milk, Natural and Artificial Flavors, Sodium Caseinate (a milk derivative), Coffee, Cocoa Powder (processed with alkali), Silicon Dioxide (anti-caking agent), Carrageenan, Dipotassium Phosphate, Propylene Glycol Esters of Fatty Acids, Mono- and Diglycerides, Salt, Soy Lecithin, Guar Gum, Xanthan Gum, Annatto Extract (for color).",N,2,3151,k/207/Carmel_Latte_Mixing_Instructions__19856.jpg,"Mixing Instructions",N,3,2696,p/689/Caramel_Latte_6x6__02326.jpg,"If you like sweet caramel and gourmet coffee drinks, wait till you try Caramel Latte Blended Ice Coffee from Big Train. Combining Arabica coffee with caramel and the finest ingredients, this drink is as easy to make as it is delicious. ",N,4,2968,l/464/BT_Poster-Caramel_Latte__53082.jpg,,N,5,2348,u/018/BT.610875-4__29720.jpg,,N,6,"Big,Train,Caramel,Latte,Blended,Ice,Coffee,3.5","Big Train Caramel Latte Blended Ice Coffee, 3.5 lb. Bag","Big Train, Blended Ice Coffee,20 Below Chocolate, 20 Below White Chocolate, Caramel Latte, Chocolate Malt, Chocolate Mint, Chocolate Peanut Butter, Coffee, Cookies n Cream, Decaf Mocha, Decaf Vanilla, Espresso, Heath Mocha, Java Chip, Kona Mocha, Mocha, No Sugar Added Mocha, Vanilla Latte, White Chocolate","Choose from hundreds of brand name products La Costa Gourmet makes online grocery shopping easy.  Big Train Caramel Latte Blended Ice Coffee,",,,,New,N,N,,N,,,0,"Default Tax Class",642628035066,N,/big-train-caramel-latte-blended-ice-coffee-five-3-5-lb-bags/,,,20501765,,
Product,962,"Add a Scoop Protein Blend, 1 lb. Can",P,S1012,,,,Right,"<p>Type a description for this product here...</p>",24.95,0.00,0.00,0.00,0.0000,N,,1.8000,0.0000,0.0000,0.0000,Y,N,,none,0,0,,2653,t/004/Protein_Blend_1lv.__37230.jpg,"Add a Scoop Protein Blend – Soy Protein Isolate, Whey Protein Concentrate, Inulin – – “Excellent” Source of protein which helps build and repair body tissues. ",Y,0,,,,,,,,,,,,,,,,,,,,,,,,,,,,,,,,"Add a Scoop Protein Blend Supplements, 1 lb. Can",,"Now supplying the Add a Scoop Protein Blend Supplement. Order your supplements online to have them delivered to your doorstep. Shop smart at La Costa Gourmet",,,,New,N,N,,N,,,0,"Default Tax Class",,N,/add-a-scoop-protein-blend-1-lb-can/,,,S1012,,
Product,963,"Add a Scoop Immune Support Blend, 1 lb. Can",P,S1006,,,,Right,"<p>Type a description for this product here...</p>",19.95,0.00,0.00,0.00,0.0000,N,,1.8000,0.0000,0.0000,0.0000,Y,N,,none,0,0,,2654,q/639/Immune_Support_1lb.__69030.jpg,"Herbs like Echinacea, Goldenseal, and vitamin C will help keep your immune system running in optimum performance. 96 servings per 1-pound canister.",Y,0,2655,e/234/Immune_Nutritional__29534.jpg,,N,1,2656,q/126/Immune_Info__62320.jpg,,N,2,,,,,,,,,,,,,,,,,,,,,,"Add a Scoop Immune Support Supplements, 1 lb. Can | S1006",,"Add a Scoop Immune Support Supplements are functional supplements. Flavorless non-GMO and gluten-free supplement boosts. Kosher, Vegetarian, and Halal certified",,,,New,N,N,,N,,,0,"Default Tax Class",,N,/add-a-scoop-immune-support-blend-1-lb-can/,,,S1006,,
Product,970,"Lion Coffee, Decaf Lion Gold Coffee, 24 Oz. Bag ",P,1249304,,,"Lion 24oz. ",Right,"<p>LION Gold Coffee is a classic light roast coffee and makes a great breakfast coffee. And while the regular LION Gold has a hefty caffeine kick, the decaffeinated version gives you all the flavor burst, without the caffeine. It's bright in the cup, with a mellow taste and a sweet and slightly citrus finish. Decaffeinated using the Swiss Water Process&reg;, which uses pure fresh water and zero harsh chemicals - never compromising the quality of our beans so you can enjoy the taste of Aloha, without the caffeine!&nbsp;</p>",23.95,0.00,0.00,0.00,0.0000,N,,1.1200,0.0000,0.0000,0.0000,Y,N,"Usually ships in 2 to 3 days.",none,0,0,,3030,y/230/Decaf_Gold_Roast__27297.jpg,"LION Gold Coffee is a classic light roast coffee and makes a great breakfast coffee. And while the regular LION Gold has a hefty caffeine kick, the decaffeinated version gives you all the flavor burst, without the caffeine. It's bright in the cup, with a mellow taste and a sweet and slightly citrus finish. Decaffeinated using the Swiss Water Process®, which uses pure fresh water and zero harsh chemicals - never compromising the quality of our beans so you can enjoy the taste of Aloha, without the caffeine! ",Y,0,3028,n/995/New_Lion_Logo__30264.png,"Roast:Light-Medium Roast
Product Line:Decaf",N,1,,,,,,,,,,,,,,,,,,,,,,,,,,"Lion Coffee","Lion Coffee, Decaf Lion Gold Coffee, 24oz. Bag | 1249304",,,,,,New,N,N,,N,,,0,"Default Tax Class",,N,/lion-coffee-decaf-lion-gold-coffee-24-oz-bag/,,,1249304,,
Product,971,"LION Gold Roast International Blend Coffee 24oz. Bag",P,1248304,,,"Lion 24oz. ",Right,"<p>Type a description for this product here...</p>",23.45,0.00,0.00,0.00,0.0000,N,,1.1200,0.0000,0.0000,0.0000,Y,N,,none,0,0,,2950,r/612/Gold_Roast_New__93167.jpg,"LION Gold Coffee is a classic light roast coffee and makes a great breakfast coffee. Which is another way of saying there's some real caffeine kick in this bag and you might not want to drink it before bed. This LION Coffee brew is bright in the cup, with a mellow taste and sweet delicate and slightly citrus finish.
Roast:Light-Medium Roast",Y,0,3029,o/926/New_Lion_Logo__46199.png,,N,1,,,,,,,,,,,,,,,,,,,,,,,,,,,"Lion Coffee, Traditional Blend Lion Gold 24 oz Bag",,"Try the traditional Lion Coffee, Lion Gold and experience the quality in Hawaiian style coffee. Shop our selection at La Costa Gourmet.",,,,New,N,N,,N,,,0,"Default Tax Class",,N,/lion-gold-roast-international-blend-coffee-24oz-bag/,,,1248304,,
Product,972,"Cafe Essentials Belgian Dark Cocoa, 3.5lb. Bag",P,4752,,"Cafe Essentials",,Right,"<p>Type a description for this product here...</p>",22.95,0.00,0.00,0.00,0.0000,N,,3.1200,0.0000,0.0000,0.0000,Y,N,,none,0,0,"Brand Names/Cafe Essentials",2727,f/798/Belgian-Style-Dark-225__91948.jpg,"A deep, dark and intense cocoa with a luxurious mouth feel and texture. Exceptional taste hot or blended. Makes an unbelievable mocha hot or cold. This is a dark, and we mean dark, semi-sweet hot cocoa. ",Y,0,2728,c/623/cafe-essentials-logo-125__44048.jpg,,N,1,,,,,,,,,,,,,,,,,,,,,,,,,,,"Cafe Essentials Belgian Dark Cocoa, 3.5lb. Bag | 4752",,,,,,New,N,N,"Delivery Date",N,,,0,"Default Tax Class",,N,/cafe-essentials-belgian-dark-cocoa-3-5lb-bag/,,,,,
